{
  "schemaVersion": "0.1",
  "generatedAt": "2026-08-03T05:41:36.852Z",
  "evidence": [
    {
      "id": "0b0da7d1-fdef-4e7e-99a4-3c221f072f76",
      "sourceFile": "spirituality.md",
      "sourceRef": "callout#2",
      "timestamp": "2025-06-22T00:00:00.000Z",
      "context": "spirituality.md",
      "observation": "Reports feeling closest to God when observing the night sky or the natural\nworld, in moments of solitude and deep thought, and during quiet acts of\nkindness.",
      "confidence": 0.65
    },
    {
      "id": "0fb748dd-f2f7-4765-9fa6-36eec6943f65",
      "sourceFile": "spirituality.md",
      "sourceRef": "callout#1",
      "timestamp": "2025-06-22T00:00:00.000Z",
      "context": "spirituality.md",
      "observation": "Religion: Islam. Describes prayer practice as inconsistent but returns to\nit; frames faith as personal reflection rather than rigid routine; values\nthe solitude of late-night prayer (qiyamullail), especially during Ramadan,\nwhich is treated as a period for personal reset.",
      "confidence": 0.7
    },
    {
      "id": "2f027ad5-8b5a-401c-b0e9-f681f0d809e3",
      "sourceFile": "personality-and-mindset.md",
      "sourceRef": "callout#1",
      "timestamp": "2025-06-22T00:00:00.000Z",
      "context": "personality-and-mindset.md",
      "observation": "Primary self-described archetype is \"the Rebel\" (challenges norms, resists\nconformity); secondary is \"the Thinker\" (introspective, analytical).\nSelf-identifies as MBTI type INFP and Enneagram 4w5 (\"the Individualist\") —\ncore fear of living a meaningless life, core desire for freedom and\nself-expression. Self-rated Big Five: high Openness, moderate\nConscientiousness, low Extraversion, moderate Agreeableness, high\nNeuroticism (prone to overthinking and emotional turbulence).",
      "confidence": 0.8
    },
    {
      "id": "35ba9054-1b3f-4d2c-b28b-c666591bf9dd",
      "sourceFile": "personality-and-mindset.md",
      "sourceRef": "callout#3",
      "timestamp": "2025-06-22T00:00:00.000Z",
      "context": "personality-and-mindset.md",
      "observation": "Finds small talk draining but tolerates it out of politeness. Reported\netiquette: respects personal space, listens more than speaks, avoids phone\nuse during deep conversation; described body language includes clasping\nhands while thinking and a deep sigh before answering hard questions.",
      "confidence": 0.6
    },
    {
      "id": "52b922a2-2d70-47b3-96d5-65b858d75dae",
      "sourceFile": "life-philosophy.md",
      "sourceRef": "callout#1",
      "timestamp": "2025-06-22T00:00:00.000Z",
      "context": "life-philosophy.md",
      "observation": "States as operating principle: \"never tell anyone anything before it's\ndone\" and \"too much availability kills your value\" — treats silence before\ncompletion and scarcity of presence as deliberate, chosen tactics rather\nthan incidental habits.",
      "confidence": 0.75
    },
    {
      "id": "5ac6e7a0-c280-4845-a7a0-2b840b738081",
      "sourceFile": "personality-and-mindset.md",
      "sourceRef": "callout#2",
      "timestamp": "2025-06-22T00:00:00.000Z",
      "context": "personality-and-mindset.md",
      "observation": "Healthy coping mechanisms named: reflective journaling, motorcycle rides,\nmusic as emotional outlet. Unhealthy coping named: emotional suppression,\noverthinking in cycles of doubt.",
      "confidence": 0.7
    },
    {
      "id": "75c4aad8-eb4e-4809-8dd9-284abb8223d1",
      "sourceFile": "thinking.md",
      "sourceRef": "callout#1",
      "timestamp": "2026-07-04T00:00:00.000Z",
      "context": "thinking.md",
      "observation": "Self-diagnosed thinking style is a hybrid of first-principles decomposition,\nsystems-architecture thinking (rebuilding into layered frameworks), and\nmeta-epistemic design (designing how thinking itself should be evaluated) —\nsummarized as \"architecting cognition systems using first-principles tools,\"\nnot pure first-principles thinking alone.",
      "confidence": 0.65
    },
    {
      "id": "7c812eba-e03f-4a80-a347-1648757fac05",
      "sourceFile": "blindspots.md",
      "sourceRef": "callout#1",
      "timestamp": "2025-06-22T00:00:00.000Z",
      "context": "blindspots.md",
      "observation": "Self-identified default response patterns under pressure: carrying too much\nalone rather than asking for help; alternating between wanting to fight the\nworld and withdrawing into silence (\"rage-tender cycle\"); punishing himself\nfor being slow, stuck, or resting (\"productivity guilt\"); preferring depth\nover everything, which leads to avoiding shallow or light-hearted\nengagement (\"control by depth\"); all-or-nothing follow-through — if it\ncan't be done fully, prefers not to start at all.",
      "confidence": 0.7
    },
    {
      "id": "85730254-5ca0-4001-943b-80896152357a",
      "sourceFile": "emotional-triggers.md",
      "sourceRef": "callout#1",
      "timestamp": "2025-06-22T00:00:00.000Z",
      "context": "emotional-triggers.md",
      "observation": "Named emotional triggers: being ignored or taken lightly; hypocrisy and\nshallow positivity; wasted potential, in self or others; being\nmisunderstood while struggling; injustice and powerlessness.",
      "confidence": 0.75
    },
    {
      "id": "8f522796-054d-41f6-b598-39225466164e",
      "sourceFile": "position.md",
      "sourceRef": "callout#1",
      "timestamp": "2026-05-15T00:00:00.000Z",
      "context": "position.md",
      "observation": "Self-described operating roles: Inquisitive (thinking), Generalist\n(learning), Founder (creating), Mentor (inspiring), Strategist (managing).\nSelf-summary: \"high-agency aesthetic male lifestyle — the intelligent,\nattractive, solitary builder.\"",
      "confidence": 0.6
    },
    {
      "id": "95467ebe-0c64-44c1-a146-32b5ed12cb3a",
      "sourceFile": "life-philosophy.md",
      "sourceRef": "callout#3",
      "timestamp": "2025-06-22T00:00:00.000Z",
      "context": "life-philosophy.md",
      "observation": "Recurring maxims recorded as personal philosophy: \"the smarter you get, the\nless you speak\"; \"pursue yourself\" (finding who you are matters more than\nseeking validation); \"what is meant for you will reach you... what isn't\nmeant for you won't reach you, even if it is between your lips\" (destiny as\nbeyond direct control); \"be a good person, but don't waste time proving\nit\"; \"God removes to replace\" (loss framed as preparation); \"strength comes\nfrom within, not external validation\"; \"you're going to piss a lot of\npeople off taking your power back — do it anyway.\"",
      "confidence": 0.8
    },
    {
      "id": "9c6fc22d-da24-4ec1-a443-f7117d354290",
      "sourceFile": "mindset-patterns.md",
      "sourceRef": "callout#1",
      "timestamp": "2025-06-22T00:00:00.000Z",
      "context": "mindset-patterns.md",
      "observation": "Self-applied labels, undeveloped: spiral-and-stack thinking, hyper\nself-awareness, oversharing vs. gatekeeping, inner-world domination,\nvisionary freeze.",
      "confidence": 0.5
    },
    {
      "id": "db867908-188f-440f-84a5-51c2b1a934c0",
      "sourceFile": "life-philosophy.md",
      "sourceRef": "callout#2",
      "timestamp": "2025-06-22T00:00:00.000Z",
      "context": "life-philosophy.md",
      "observation": "States as operating principle: \"keep your friends for friendship, but work\nwith the skilled and competent\" — draws an explicit line between\nrelationship and collaborator selection. Separately states a hope to\n\"inspire others to think critically and question systems\" as the intended\ncommunity-level impact of his work.",
      "confidence": 0.6
    },
    {
      "id": "e437fa0e-e6ad-4f12-8986-dfed127f937c",
      "sourceFile": "spirituality.md",
      "sourceRef": "callout#4",
      "timestamp": "2025-06-22T00:00:00.000Z",
      "context": "spirituality.md",
      "observation": "States four core values: independence and self-authenticity (carving one's\nown path); truth-seeking (challenging societal conditioning); emotional\nresilience (respecting strength through struggle over easy solutions); and\njustice/integrity, with explicit dislike of hypocrisy in religious and\npolitical systems.",
      "confidence": 0.75
    },
    {
      "id": "e4ef874d-35c1-4727-914f-1d68e53f1231",
      "sourceFile": "spirituality.md",
      "sourceRef": "callout#3",
      "timestamp": "2025-06-22T00:00:00.000Z",
      "context": "spirituality.md",
      "observation": "Describes an ongoing, unresolved tension between structured religious\nexpectation and personal freedom/individualism; names overthinking about\nlife's purpose as what makes surrendering to fate (tawakkul) difficult, and\nframes this as something actively being worked on rather than settled.",
      "confidence": 0.6
    }
  ],
  "parameters": [
    {
      "id": "265501bc-6378-4bf4-9f04-878a8c4589dc",
      "name": "default stress-response patterns",
      "domain": "Adaptation",
      "evidenceIds": [
        "7c812eba-e03f-4a80-a347-1648757fac05"
      ],
      "pattern": "control-by-depth",
      "confidence": 0.7,
      "status": "draft"
    },
    {
      "id": "28f37f33-dbfb-4173-bd6b-2b6dcde648c3",
      "name": "self-diagnosed thought patterns",
      "domain": "Human",
      "evidenceIds": [
        "9c6fc22d-da24-4ec1-a443-f7117d354290"
      ],
      "confidence": 0.5,
      "status": "draft"
    },
    {
      "id": "30548375-3a93-4870-84ba-bf8ec9d442a4",
      "name": "communication and disclosure strategy",
      "domain": "Strategy",
      "evidenceIds": [
        "52b922a2-2d70-47b3-96d5-65b858d75dae"
      ],
      "pattern": "silence-as-leverage",
      "confidence": 0.75,
      "status": "draft"
    },
    {
      "id": "37607db9-6ea3-4ae5-afd6-eedc7a550657",
      "name": "faith practice and spiritual connection",
      "domain": "Human",
      "evidenceIds": [
        "0fb748dd-f2f7-4765-9fa6-36eec6943f65",
        "0b0da7d1-fdef-4e7e-99a4-3c221f072f76"
      ],